{
  "schema": "nova4.n3-ana-011-contract.v1",
  "sha256": "63b5e3ae60a38f892768c791765a6f4dd99073586dbeada06e66f7c02b5caf8b",
  "source": {
    "branch": "nova/analytic-density",
    "handoff": "N3-HO-N4-002",
    "handoff_commit": "7469dada02fa4caca08ed391ef8b0cb0f1e855b2",
    "imported_n1": {
      "blob_sha": "4255e76ff18f675ae80a0192381070d9a934fc97",
      "commit": "fa11f4b2cb86a2dd791df189ada12757be791804",
      "file": "tracks/nova1-factorial-structure/proofs/HIGH_PRIME_MENU_CAPACITY.md",
      "object": "N1-STR-009"
    },
    "object": "N3-ANA-011",
    "proof_file": "tracks/nova3-analytic-density/proofs/EXPLICIT_PRIME_INTERVAL_AND_CAPACITY.md",
    "proof_file_blob_sha": "e36daf98db86da16bd5ed8c6c82f43530d745f66",
    "repository": "Lumathpolgar/erdos18-factorial-program",
    "request": "H",
    "request_G": {
      "audit_sha256": "e26653648c2cc9ebc30b03f01904dbb5bcca65737ead57abc9cdbc0b2f218bb0",
      "claim_sha256": "e41f7e639c605ed4e70e4ac2cc6afe20d83ef8bf4f22e991fe0986449b9c1e88",
      "range": [
        120368,
        1000000
      ]
    },
    "sanity_file": "tracks/nova3-analytic-density/proofs/prime_interval_capacity_sanity.py",
    "sanity_file_blob_sha": "519c900b616a33d95f3b2a8a8dec10d04a0a24f5"
  },
  "theorem": {
    "address_extension_proof_supplied": false,
    "address_legal_max": "floor(v2(n!)/2)-1",
    "decision": "ACCEPTED",
    "distinct_numerical_sums": false,
    "half_endpoint": "floor(n/2)",
    "half_endpoint_analysis": "pi(n/2)=pi(floor(n/2)) for integer n",
    "integer_threshold": 120368,
    "menu_definition": "u|n!, u odd, u>1, 2^e*u<=floor(sqrt(n!))",
    "menu_lower_bound": "2^(m_n-1)-1",
    "menu_unit_excluded": true,
    "object": "N3-ANA-011",
    "profile_injectivity": false,
    "profile_object": "formal profiles",
    "request_G_finite_only": true,
    "scope": {
      "additive_occupancy": false,
      "address_legality": true,
      "erdos18_solved": false,
      "factorial_half_range": false,
      "formal_profile_capacity": true,
      "menu_cardinality": true
    },
    "threshold_finite_supplement": false,
    "uniform_theorem_source": "analytic proof, not finite sweep"
  }
}
